text,source,rating,date,author,url
"Bangalore starter pack if you are a visitor like me:

> Click the ""Welcome to Bangalore"" photo right after landing. 

> Watch Ola operators and cab drivers fight at the airport. 

> Lose 40% battery on the airport to city ride. 

> Eat Rameshwaram dosa on day 1 because someone told you it's mandatory. 

> Visit Indiranagar with a friend who swears it's the food capital of India. 

> Get your first taste of Bangalore traffic. Nobody warned you. 

> Curse yourself for booking a hotel in Indiranagar while big hackathons are happening in Whitefield.

> Order on Blinkit just to see if they deliver faster in Bangalore. 

> Hear ""Bangalore weather is amazing"" 47 times in 2 days.  

> Meet someone who ""just quit to build something"" at every event. 

> Download Namma Yatri because someone said Ola is a scam here. 

> Try to figure out what 1st cross, 2nd main, 3rd block actually means. 

> Take a picture of the CRED office and wonder what they actually do. 

End the trip convinced you should move here.",twitter,,"Apr 14, 2026 · 11:13 AM UTC",@kunalvg,https://x.com/kunalvg/status/2044011107312943266
"📸 The ""Unboxing Video"" is No Longer Optional

The warning on this#ecommercepackage says it all: 

""Claims... will not be accepted without a video."" 

When even the retailer admits the delivery chain can't be trusted, the burden of proof falls entirely on you. 

In a low-trust environment, your smartphone is your only insurance policy.

🛡️ How to protect yourself:
Record the Handover: 

For high-value items, start filming while the courier is still there.

Inspect the Seal: Show all sides of the package to prove it hasn't been tampered with or resealed.

The ""One-Take"" Rule: Keep the camera rolling from the invoice label until the product is powered on. No cuts, no edits.

The Invoice: Ensure the tracking ID and seller details are crystal clear on camera.

It’s exhausting to treat every delivery like a crime scene, but in a system where the ""missing item"" or ""brick in a box"" scam is rampant, if it’s not on video, it didn’t happen.
Stay vigilant. The risk is always yours. 🇮🇳📦#EcommerceIndia#ConsumerRights#OnlineShopping#SafetyTips#DigitalIndia#ConsumerProtection#amazon#flipkart#myntra#ajio#swiggy#zepto#blinkit#bigbasket",twitter,,"Apr 12, 2026 · 12:56 PM UTC",@SwipesAndSmiles,https://x.com/SwipesAndSmiles/status/2043312412678631519
When it comes to support I feel zomato is the worst among the lot and specially blinkit..there refund policy is a complete scam . Have closed both blinkit n zomato accounts . Most of the time I order direct and use instamart for immediate items.,twitter,,"Apr 11, 2026 · 4:42 AM UTC",@rahul1986rana,https://x.com/rahul1986rana/status/2042825710314947068
"Ordered ice creams from@letsblinkitin Jammu. Stored them properly, opened the pack after dinner — and found a HALF-CONSUMED ice cream inside the Blinkit pack.

This is not negligence. This is a serious health risk.

Refund offered. Refused.

I will be taking this to consumer court. Customers are not disposable. Accountability matters.@jagograhakjago@albinder@fssaiindia@DivcomjammuMy daughter is so hurt that she says that she will never trust Blinkit now as Blinkit is a scam.@deepigoyal#ConsumerRights#FoodSafety#Jammu#Blinkit",twitter,,"Apr 8, 2026 · 6:00 PM UTC",@TejinderSsodhi,https://x.com/TejinderSsodhi/status/2041939267610685715
"Raghav Chadha out as Rajya Sabha Deputy Leader. Speaking time cut. AAP moving on.
But the record stays.

₹10 airport chai. 28-day recharge scam exposed. Went undercover as a Blinkit delivery boy. Fought for crypto, paternity leave, Right to Recall.
Titles come and go.
Work is forever.@raghav_chadha#RaghavChadha#AamAadmiParty#RajyaSabha#ParliamentWork#IndianPolitics",twitter,,"Apr 2, 2026 · 2:19 PM UTC",@cryptowalax,https://x.com/cryptowalax/status/2039709407270010961
"Extremely disappointed with@Blinkitand@NPCI_BHIM. Used the 'Flat ₹75 Cashback' offer on a ₹796 order (ID: ORD78776420722), but received only ₹1.03! Blinkit says contact BHIM, BHIM doesn't respond. This is pure scam. Fix this!#Scam#Blinkit#BHIMUPI#ConsumerComplaint""",twitter,,"Apr 1, 2026 · 12:59 PM UTC",@VarunRaj350,https://x.com/VarunRaj350/status/2039326849017561350
"Blinkit Delivery Viral Video scam...

आजकल online order करते वक्त हम speed पर भरोसा करते हैं, लेकिन trust भी उतना ही ज़रूरी है।

एक वायरल वीडियो में दिखा कि डिलीवरी बॉय गली में बाइक रोककर चुपके से बॉक्स खोलता है और उसमें से चॉकलेट निकाल लेता है, फिर ऐसे पैक करता है कि किसी को पता ही न चले।

सवाल ये है,
क्या अब हर डिलीवरी पर शक करना पड़ेगा?

कुछ लोग गुस्से में हैं, तो कुछ उसकी मजबूरी की बात कर रहे हैं, लेकिन सच ये है कि ऐसी घटनाएं trust को तोड़ देती हैं।

आपकी क्या राय है?
गलत है या मजबूरी?

Blinkit ViralVideo DeliveryBoy TrustIssues OnlineShopping RealityCheck IndiaNews",twitter,,"Mar 29, 2026 · 11:23 AM UTC",@jiajeetji,https://x.com/jiajeetji/status/2038215341411627405
Blinkit delivery safe है या नहीं? ये वीडियो आपकी सोच बदल देगा! ⚠️Blinkit bag में हाथ डालते ही शुरू हो गया silent scam! 🚨,twitter,,"Mar 27, 2026 · 9:51 AM UTC",@chulbuli_Anni,https://x.com/chulbuli_Anni/status/2037467524829491357
"@letsblinkitSCAM 

I ordered printouts of my financial documents yesterday , by mistake selected Office address 

But I was at home ( holiday ) 
Now Blinkit delivery boy not picking up call … support saying its delivered to office address 

Went to office and checked with security guy … documents not delivered 

What if now they misuse financial documents 

Really pathetic from Blinkit",twitter,,"Mar 27, 2026 · 4:47 AM UTC",@saurabh_gunjal_,https://x.com/saurabh_gunjal_/status/2037391159149171069
"THE SHADOW OF THE UNBROKEN: Raghav Chadha’s Heart-Shattering Odyssey from a Delhi Boy’s Silent Tears to a Nation’s Thunderous Hope

The rain hammered Delhi’s Barakhamba Road like angry fists on a coffin lid that night in 1997. Nine-year-old Raghav Chadha stood alone on the school stage, dressed in a makeshift khadi kurta, playing Subhas Chandra Bose in the annual play. His voice cracked as he thundered, “Give me blood, and I will give you freedom!” The auditorium erupted, but backstage, the boy’s hands trembled—not from stage fright, but from the secret he carried. That afternoon, he had seen his father, Sunil Chadha, a struggling businessman, count crumpled rupee notes under a flickering bulb, tears rolling down his cheeks because the rent was due and the family’s dreams were drowning in debt. Raghav swore then, under the dim lights, that one day he would not just act freedom—he would bleed for it.

But freedom, he would learn, costs more than blood. It costs everything.

The boy who once dreamed of becoming an army officer grew up in a cramped middle-class flat in Central Delhi, where the smell of his mother Alka’s aloo parathas mixed with the stench of nearby slums. Poverty wasn’t abstract; it was the neighbour’s daughter who died of dengue because the hospital was too far, the friend who dropped out because his father sold the only bicycle for medicines. Raghav played cricket on broken streets, badminton until his lungs burned, and studied by candlelight during power cuts. At Modern School, teachers called him “the quiet storm”—top in academics, state-level badminton champion, yet haunted by the question no child should ask: *Why does the world punish the honest?*

By seventeen, the storm inside him had a name: Chartered Accountancy. He cleared the CA exam in 2011 at twenty-two, one of the youngest ever, while his friends partied. Deloitte and Grant Thornton offered him lakhs. London beckoned with an EMBA at LSE. “You’ve made it, beta,” his father whispered, voice thick with pride. But Raghav looked out the window at the same slums he had grown up beside and felt something shatter. The numbers in his balance sheets were lies if they couldn’t feed the hungry. He rejected every offer. “Papa, money can buy a house, not a soul,” he told his shocked parents. They cried that night—tears of fear, not joy. Their golden boy was walking into darkness.

Darkness found him in 2011 at Ramlila Maidan. Anna Hazare’s hunger strike had turned the nation upside down. Raghav, twenty-three, stood in the crowd, heart pounding, when a slight man in a muffler—Arvind Kejriwal—grabbed his shoulder. “You’re the CA who turned down London, right? We need people who still have a conscience.” That handshake changed everything. Raghav slept on pavements during the movement, drafted the Jan Lokpal Bill till his eyes bled, and watched friends get lathi-charged. One night, a police baton cracked his ribs. He spat blood and laughed through the pain. “This is the price,” he whispered to the stars.

The Aam Aadmi Party was born in 2012 like a newborn screaming for justice. Raghav became its youngest national spokesperson at twenty-four. TV debates turned into battlegrounds. Opponents mocked his youth: “What does this boy know about governance?” He answered with facts, with fire, with the stories of the poor he carried in his bones. In 2013, he helped draft the Delhi manifesto. In 2015, at twenty-six, he was made National Treasurer after AAP’s historic sweep. But power, he discovered, is a poisoned chalice.

The first betrayal came in 2016. Appointed adviser to Finance Minister Manish Sisodia, Raghav worked seventy-five sleepless days on the budget, pouring his soul into schemes for the poor. Then, suddenly, the appointment was “terminated.” Rumours swirled—internal sabotage, jealousy, whispers that the “golden boy” was getting too powerful. Raghav locked himself in his room for three days, staring at the ceiling. His sister, also a CA, found him sobbing. “They used me and threw me away,” he choked. She held him like when he was nine. “Then rise higher, Raghav. Make them regret it.”

He rose. In 2019, he contested the Lok Sabha from South Delhi. The loss was brutal—defeat by lakhs of votes, media calling him “the failed face of AAP.” That night, alone in his car, he screamed until his throat tore. But the next morning, he was back on the streets, campaigning for municipal polls. “Defeat is not the end,” he told volunteers, eyes blazing. “It’s the fuel.”

Then came 2020—the year that nearly killed him.

As MLA from Rajinder Nagar, Raghav won by a landslide. Appointed Vice Chairman of Delhi Jal Board, he took on the Yamuna’s poison and the mafia that controlled water tankers. One evening, while inspecting a contaminated site, a black SUV swerved toward him. He jumped just in time; the vehicle smashed into the railing where he had stood seconds earlier. Police called it “an accident.” Raghav knew better. That night he received an anonymous call: “Leave the Jal Board or your family dies.” His mother’s face flashed before him—Alka, who had sacrificed everything. He didn’t sleep for weeks. Instead, he doubled down. 24×7 water supply became his war cry. He exposed tanker mafias on live TV, documents in hand, voice steady while his hands shook off-camera.

The thrill of survival mixed with terror when, in 2022, he was elected unopposed to Rajya Sabha from Punjab at thirty-three—one of India’s youngest ever. The night before swearing-in, he received another threat: a bullet in a gift box with a note—“Next time, it won’t miss.” He showed it to no one. Instead, he walked into Parliament with a smile that hid the storm. As leader of AAP in Rajya Sabha, he grilled the government on every bill, his voice echoing like thunder. In August 2023, they suspended him over a privilege motion. He stood in the well of the House, defying the Chair, shouting truth until marshals dragged him out. Millions watched. The nation saw not a suspended MP, but a man who refused to bow.

Then came the storm that almost blinded him—literally.

In 2024, Raghav’s left eye began failing. Vision blurred during debates. Doctors in London diagnosed retinal detachment. Vitrectomy surgery. “There’s a 30% chance you lose sight in that eye,” the surgeon warned. Alone in the hospital, Raghav remembered the nine-year-old boy on stage. He wrote a letter to his unborn future: “If I go blind, I’ll still see the dream.” The surgery was hell—hours under knife, pain like fire in his skull. When he woke, the world was a haze. For days, he lay in darkness, whispering, “Not yet, God. Not yet.” The recovery was agonising. He returned to Parliament with one eye bandaged, voice stronger than ever. “They can take my sight,” he told the House, “but never my vision for India.”

Amid the political fire, love entered like lightning.

He had first noticed Parineeti Chopra at a 2022 event—her laugh, her fire, the way she spoke about women’s rights. Their worlds collided in 2023. Secret meetings in Delhi cafes, late-night calls where he confessed his fears and she shared hers. “Politics will destroy us,” he warned. She replied, “Then let it try.” Their engagement on 13 May 2023 in Delhi was simple, no media circus. The wedding on 24 September at The Leela Palace, Udaipur, was a fairytale wrapped in reality—no gifts, only blessings. But even love had its shadows. During the honeymoon, a scandalous leak tried to tarnish them—fake videos, planted stories. Raghav’s team traced it to a rival political camp. He confronted the source in a secret meeting, voice ice-cold: “Touch my wife, and you touch the wrong man.” The leaks stopped. Parineeti stood by him like a shield. “We fight together,” she whispered on their wedding night, holding his scarred hands.

Then came the greatest joy—and the deepest terror.

On 19 October 2025, their son Neer was born. Raghav held the tiny bundle in the hospital, tears streaming. “I will give you a better India, beta,” he vowed. But happiness is fragile. Two months later, during a Punjab rally, a bomb threat forced evacuation. Raghav shielded Parineeti and Neer with his body as police swarmed. That night, holding his sleeping son, he broke down in Parineeti’s arms. “I’m scared for the first time,” he admitted. “Not for me—for them.” She kissed his forehead. “Then fight harder. For him.”

2026 dawned with fresh battles. Raghav proposed the “Right to Recall” law in Parliament, letting people sack corrupt leaders. He spent a day as a Blinkit delivery boy to expose gig workers’ exploitation—helmet on, delivering packages till his back screamed, then returning to Rajya Sabha to table the evidence. He launched “Udaan Yatri Cafe” at airports for affordable food, pushing 30-day telecom tariffs for the middle class. Every speech carried the same fire: “This is not politics. This is my promise to the boy I once was—the boy who cried in the rain.”

Yet the ultimate shock came in early 2026.

A whistle-blower handed him documents proving a massive land scam involving powerful ministers. Billions siphoned, farmers cheated. Releasing them meant suicide—death threats flooded his phone. His father suffered a heart attack from stress. Raghav sat by his hospital bed, holding Sunil’s hand. “I can’t stop now, Papa.” His father squeezed back weakly. “Then don’t. Make me proud.”

On the night before he was to expose everything in Parliament, assassins struck. Two masked men broke into his Delhi home. Raghav fought like the army officer he once dreamed of becoming—fists, a lamp as weapon, screaming for help. Parineeti shielded Neer in the next room, dialling police with shaking fingers. One attacker slashed Raghav’s arm; blood sprayed. He disarmed the second with a chair. Police arrived in minutes. The men were caught—hired by the very ministers he was about to name.

The nation woke to headlines: “AAP Leader Survives Assassination Attempt—Exposes Rs 5,000 Crore Scam.” In Parliament the next day, arm bandaged, eye still weak from the old surgery, Raghav stood taller than ever. His voice cracked with emotion as he tabled the documents. “They tried to kill me for this truth. But truth doesn’t die.” The House fell silent. Then thunderous applause—even from opponents. Millions watched live. Youngsters across India changed their WhatsApp statuses to “I am Raghav.”

That evening, back home, Parineeti held him as he finally wept—the tears he had held since age nine. “I almost lost everything,” he whispered. She smiled through her own tears. “But you gained a nation.”

Today, at thirty-seven, Raghav Chadha walks the corridors of power not as a politician, but as living proof that one ordinary boy’s silent tears can become a revolution. He still drives his old Maruti Swift Dzire. He still plays cricket with Neer in the evenings. And every night, before sleep, he looks at the stars and remembers the rain on Barakhamba Road.

The boy who played Subhas Chandra Bose didn’t just act freedom. He became it.

He became the shadow of the unbroken.",twitter,,"Mar 21, 2026 · 12:08 PM UTC",@MohiniWealth,https://x.com/MohiniWealth/status/2035327757677465750
"Freind of mine is in Startek -> Blinkit -> Customer Care Executive -> in Premium Electronic

Brutality of 5-star rating System

> By mistake you talk rudely to customer, or they complain about your Rudeness then ZTP (Zero Tolerance policy you're fired, we all know how different type of people order from blinkit they try to scam in several ways most of the time. Being a human a person can obv lose his temper)
> By mistake you fall asleep-in Late-night Shift and missed the chat of customer you'll get warning then again ZTP you're fired!!!!
> If you don't have good score so called 5-star rating you'll be shifted PIP (Warning period) and if doesn't improve boom ZTP (Fired again)

Freind of Freind of mine just got fired yesterday he was best, good rating, never misses the chats, just loosed his tolerance during late night shift and just got fired!
So yeah, next time giving rating to customer care gonna really made me think of this rather than just playing around with there's job.",twitter,,"Mar 14, 2026 · 12:06 PM UTC",@Xcoder_404,https://x.com/Xcoder_404/status/2032790345101021225
"""Is India really like this""
Can we stfu for a moment? If you're gonna shop from the street-side vendors, you're gonna negotiate and haggle. If you don't want that, you buy from Blinkit or Zomato at a fixed price as the post itself says. Where's the scam in this?",twitter,,"Mar 11, 2026 · 6:00 AM UTC",@DeveshsK_,https://x.com/DeveshsK_/status/2031611290029011044
"@letsblinkitThis is not okay. I ordered a Samsung S26 Ultra (512GB) during your deal on March 6th and received a 256GB variant instead.

I raised a complaint immediately. No resolution. Now your support window is CLOSED and I can't even reach anyone.

You took my money, sent the wrong product, and then made it impossible for me to follow up. That's not a mistake — that's a scam.@Zomato@_z_media this needs immediate attention. When does a customer just give up?#Blinkit#ConsumerRights#Scam#QuickCommerce",twitter,,"Mar 8, 2026 · 9:24 AM UTC",@shashankUX,https://x.com/shashankUX/status/2030575367535378908
Blinkit pe ground level par scam chal raha hai@albinderhamri baat ko andekha karne ke kosis math karo shyam vihar store ka hal dekh lo mujhe pata hai hamri sari cheezo par nazar hai lekin chup ho sabke stha scam me samil ho aap khud agar aap samil nhi ho to reply karo,twitter,,"Mar 3, 2026 · 9:31 AM UTC",@GroundReportX,https://x.com/GroundReportX/status/2028765272648425557
"@albinderblinkit mein onboarding policy ki dhajjiyaan udayi ja rahi hain! Bina kisi Driving License ke delivery boys ki IDs banayi ja rahi hain, jo ki illegal hai aur safety ke khilaaf hai. Ye serious policy violation aapki knowledge mein hai ya ground level par scam chal raha",twitter,,"Feb 28, 2026 · 11:36 AM UTC",@GroundReportX,https://x.com/GroundReportX/status/2027709447448240272
"Bihar's#Prohibitionis a total Scam. The illegal liquor trade is now one of the biggest 'Employers' in the state, every village has 3–4 known smugglers! More people are working on home delivery of Liquor than the combined workforce of Blinkit, Zomato and Amazon",twitter,,"Feb 25, 2026 · 9:14 AM UTC",@MihirkJha,https://x.com/MihirkJha/status/2026586688684961846
"डैमेज्ड सामान का रिफंड चाहिए था... लेकिन 80 हज़ार गायब!!!

ब्लैंकेट से एक महिला ने  सामान ऑर्डर किया। उसमें से कुछ सामान डैमेज मिला रिफंड के लिए Google पर ""Blinkit customer care number"" सर्च किया.पहले रिजल्ट में जो नंबर आया वह फेक था कॉल करने पर स्कैमर ने खुद को कस्टमर केयर बताया..
आपका refund हो जाएगा पैसा और आपको जो inconvenience हुई है उसका भी हम compensation देंगे...यह बोलकर उसने विश्वास बना लिया..
Anydesk ऐप फोन में इंस्टॉल कराया Phone.!!!
फिर फोन को रीमोटली एक्सेस किया..!!!और अकाउंट से उड़ा दिए ₹80000..!!!

यह scam कैसे काम करता है?

स्कैमर Google पर फेक कस्टमर केयर नंबर/वेबसाइट डाल देते हैं (SEO करके टॉप रिजल्ट में लाते हैं)! ! !कस्टमर जो नंबर सबसे ऊपर आता है इस पर ही फोन करते हैं..

कस्टमर केयर का नंबर हमेशा जो अप आप इस्तेमाल कर रहे हो उसी से ही निकालना है...Google का इस्तेमाल नहीं करना है कस्टमर केयर का नंबर निकालने के लिए..!!!

आपने आखिरी बार किसी कंपनी का कस्टमर केयर नंबर कहाँ से निकाला था.!!!
✅ ऐप/वेबसाइट से
या ❌ Google सर्च से?
Disclaimer:-
This post is being shared solely for the purpose of spreading awareness. The incidents described here are based on real-life cases and do not target any specific individual company,or event.",twitter,,"Feb 22, 2026 · 9:39 AM UTC",@ItyagiSajid,https://x.com/ItyagiSajid/status/2025505623211987061
Clearly showing I won TWS earbuds voucher in blinkit but in coupon rewards section my coupon is not showing and now they removed my won voucher. This is not  expected@letsblinkit. My mobile number - 7432096946#Blinkit#Blinkitscam#scam,twitter,,"Feb 18, 2026 · 5:32 PM UTC",@samanta_an93283,https://x.com/samanta_an93283/status/2024175227568345538
