text,source,rating,date,author,url
"Scam on.!! Ordered headphones from Blinkit and got scammed. Box was unsealed, the delivery guy ran off, and customer service was useless. Don’t trust Blinkit for electronics — beware before you buy!@letsblinkit@jagograhakjago",twitter,,"May 20, 2025 · 4:48 PM UTC",@AmirShaikh44835,https://x.com/AmirShaikh44835/status/1924869976516882477
"Zepto wouldn't dare come here to validate.
Zomato zepto blinkit 
Use this same loop hole to scam and steal money. And the breakdown in zomato is purposely minimized bar always expand and verify.",twitter,,"May 18, 2025 · 8:08 PM UTC",@TheDocKnowsAll,https://x.com/TheDocKnowsAll/status/1924195368482619432
"Dear#Blinkit@letsblinkit, please stop this scam, Order kuch kiya, deliver kuch aur hi kiya, jo screen recorded video post ki hai... Usme app dekh rhe hai ki apke catalog me#Kinderjoy@kinderuska#DisneyPrincess theme base product tha... Jo mene order kiya tha.@zomato",twitter,,"Apr 6, 2025 · 10:26 AM UTC",@journo_Mehra,https://x.com/journo_Mehra/status/1908828559193362499
"I ordered milk at 12, and after waiting for 1.5 hours, they canceled my order. What kind of scam is BigBasket? I don’t know how Tata owns this useless app.I’ll order from Blinkit or Zepto. Not using this garbage again!@bigbasket_com",twitter,,"Mar 13, 2025 · 8:16 PM UTC",@Bogeyman707,https://x.com/Bogeyman707/status/1900279719964393900
"I had ordered from blinkit and then cancelled for ₹290, after that i have cancelled and your company agent said that it will be refunded in original source but now i have received message of promo code which is scam me@letsblinkit@zomato@zomatocare@blinkitcares@deepigoyal",twitter,,"Mar 9, 2025 · 10:09 AM UTC",@delhicitizenn,https://x.com/delhicitizenn/status/1898677634176782676
"Bank is saying it is transferred#blinkitis saying transaction failed. Delivery boy who delivered the products, his phone is switch off since then. Is this a new#scam. Where is my money as neither bank nor blinkit has it.@letsblinkit@blinkitcares@blinkiteng",twitter,,"Feb 23, 2025 · 5:08 AM UTC",@aviralm91143091,https://x.com/aviralm91143091/status/1893528279988007104
"""@OnePlus_IN@oneplus@OnePlus_Support@letsblinkitI ordered OnePlus earphones from Blinkit, but the box arrived EMPTY! This is a scam, and I demand an immediate replacement or a full refund. This is unacceptable from such a reputed brand. Please resolve this ASAP!#OnePlus",twitter,,"Feb 16, 2025 · 4:54 PM UTC",@SamratM14871982,https://x.com/SamratM14871982/status/1891169374498623816
"Topmate is a scam. Modern problems require modern slavery.

Said a few individuals

But it’s hard that they know the reality.

I’ve been on both sides of the story.
There was a time when I was the one desperately looking for just one project, browsing job portals, LinkedIn, Naukri, Indeed, and Facebook groups, DMing recruiters, cold-emailing hiring managers, and asking for jobs.

And then, I was on the other side as well.

At EY, my inbox was flooded with resumes - day and night. Friends, family, acquaintances- all sending the same message: ""Hey, here’s my resume. Please refer me.""

Why?
Because employee referrals are the best way to land a job.

People have always done this. We just built a better way.

Topmate didn’t just launch a ‘feature.’ We built solutions for real problems:

- Want to find people who can help you? → Use Auto DM
- Need a referral for a specific job? → Try Referral by Job ID
- Want expert guidance instantly? → Book a Live Call

It wasn’t about charging for referrals because we didn’t.
It wasn’t about gatekeeping opportunities because we didn’t.
It was about bridging the gap between job seekers and providers, making it easier, faster, and more efficient.

But as always, innovation attracts noise.

""How Dare They?""

Somewhere along the way, people started saying we were charging for referrals.
Where? No idea. Because we never mentioned a price.

•⁠  ⁠No paywall
•⁠  ⁠No price slash
•⁠  ⁠No hidden fees

That’s how misconceptions spread faster than facts.

•⁠  ⁠No one believed that you could connect with astrologers online, but AstroTalk scaled to ₹146 Cr+ revenue in FY23.
•⁠  ⁠No one thought quick commerce was feasible, but today, we can’t survive without Blinkit, Zepto, or Instamart.
•⁠  ⁠And when we said, ""We are delivering humans,"" - it was about delivering human expertise, highlighted by money control.

Sure, the wordplay was bold. But thought leaders knew what we meant. This wasn’t just a viral tweet.

We built tech to handle thousands of users overnight
We shared real-time engagement to clear misconceptions
We did constant backend iterations to improve the experience

The impact? 530 people connected with their favourite individuals to seek guidance.

But sure, let’s pretend making job searches smarter is the real problem here.

Meanwhile, thousands found referrals, experts, and guidance in minutes except for the unnecessary struggle.",twitter,,"Feb 11, 2025 · 5:01 AM UTC",@NimishaChanda,https://x.com/NimishaChanda/status/1889177882737492154
"@ZeptoNowis playing with end users now.

Pricing on Android vs Apple for@RockWithboAt, isn’t it a scam?#zepto#blinkit#Ecommerce#India#awareness",twitter,,"Feb 10, 2025 · 8:02 AM UTC",@hiesid,https://x.com/hiesid/status/1888861104811790821
"Spent months helping App Stores take down fake apps.

Now LinkedIn thinks I’m perfect for a “Store Assistant” job 👨‍💼

Guess it’s time to scan barcodes instead of scam apps. CFBR folks, hook me up with a role at your nearest Zepto/Blinkit dark store.",twitter,,"Jan 28, 2025 · 6:49 AM UTC",@pooniawalla,https://x.com/pooniawalla/status/1884131637807702104
"2G (scam) leading to widespread internet penetration. Consumer tech economy growing like wildfire. Unlimited convenience compared to west (UPI, Swiggy, Blinkit et al)",twitter,,"Jan 19, 2025 · 9:18 AM UTC",@DexterousRd,https://x.com/DexterousRd/status/1880907569339986324
Bahaut bada scam hai yeh blinkit ka 10mins delivery in Pune especially. Honestly my Instamart delivery comes faster. They have made me wait 45mins few weeks back and I nearly missed a flight because of it.,twitter,,"Jan 16, 2025 · 2:45 PM UTC",@scotthakuraaiin,https://x.com/scotthakuraaiin/status/1879902850098336238
"I have already said it once, and I'll say it again. STOP USING ZEPTO, UBER, OLA, SWIGGY, ZOMATO etc. Their WHOLE business model is charging extra fees for no reason. They charge double for no reason. Yet people still fall for this scam. 
-If you are using Uber/ola often, then that means you are not managing your time. All major cities including Bengaluru has good public transport with last mile connectivity. Learn to leave your house early so that you will reach your destination on time. You will learn about punctuality and time management.
-Zomato/Swiggy: If you are in Bengaluru and you use Zomato/Swiggy, you are the biggest fool on the planet. There's on an average one good restaurant on every street in Bengaluru, go outside and eat. Or else you can learn a new skill called ""cooking"".
Zepto/Blinkit - Bruh, you are not staying in a forest, there is More, Dmart, provision store or at least a kiarana store on every road. Go there and buy your stuff.
At the end of the day don't give your hard earned money to these useless greedy ""start-ups"".",twitter,,"Jan 14, 2025 · 6:15 PM UTC",@PriyankaKharge,https://x.com/PriyankaKharge/status/1879230850396827737
"Tech News is Live ❤️ 

Jio Big Scam😶,IPL 2025 Date😍,Rent A Phone,realme Neo 7 Pro,Nokia Shutdown😓,Blinkit Good Newspiped.video/lD7oM8MMkDY",twitter,,"Jan 14, 2025 · 12:03 PM UTC",@AmreliaRuhez,https://x.com/AmreliaRuhez/status/1879137300900368411
"From Nayak movie times -
We would hear the same dialogue

""Iss desh me 30 min. me Pizza deliver ho jata hai pr ambulance nahi...""

Blinkit a 10 min delivery app, started an affordable ambulance service is truly commendable...
🫡

(Just hope it's not a scam🙏)",twitter,,"Jan 2, 2025 · 4:32 PM UTC",@kunalthakur2020,https://x.com/kunalthakur2020/status/1874856184861372630
@albinder@letsblinkit@CyberdostI lost money due to scam. Scamers has sent ₹130000 from my account to blinkit the name that comes is VIN*BLINKIT . Please help to find that scamer,twitter,,"Jan 1, 2025 · 12:17 PM UTC",@buzzbee_IN,https://x.com/buzzbee_IN/status/1874429838477730188
"Bengaluru man calls out Blinkit over free oil 'scam', receives refund for missing itemhindustantimes.com/cities/be…",twitter,,"Dec 30, 2024 · 9:14 AM UTC",@htTweets,https://x.com/htTweets/status/1873659027345007015
Bjp mp accuses q com firms zepto blinkit of fdi scam. Releases white paper.,twitter,,"Nov 16, 2024 · 6:55 AM UTC",@sanket,https://x.com/sanket/status/1857678791419572283
"FDI Scam: BJP के अपने MP ने लगाया Blinkit-Zepto-Instamart पर आरोप! 

देखिए ‘इशारों इशारों में’@sanketके साथ।#BJP#Zepto#Blinkit#instamart#FDIScamFull Video linkpiped.video/mphi6RfvcaY?si=IqrL…",twitter,,"Nov 16, 2024 · 5:54 AM UTC",@TheRedMike,https://x.com/TheRedMike/status/1857663618260799494
"@letsblinkit@blinkitcares@deepigoyalwhat kind of scam you guys are running at Blinkit?
I ordered few items today as my mom was alone at home and she received a product which was expired 3 months ago. I tried raising it to your support but no help. 
It's about safety.",twitter,,"Nov 11, 2024 · 1:37 PM UTC",@drunkgeek_,https://x.com/drunkgeek_/status/1855968056058503554
An X user claimed#Blinkit’s online gold purchase scheme is a scam after he was given the wrong product. The user ordered a gold coin from Blinkit as part of the company’s 10-minute delivery for gold/silver coins during the#Diwalifestival season.trib.al/D6S4irF,twitter,,"Oct 30, 2024 · 12:00 PM UTC",@the_hindu,https://x.com/the_hindu/status/1851594972136382627
"'I was scammed, cried while talking to delivery executive': Man orders gold coin from Blinkit, claims to receive wrong item#Blinkit#goldcoin#scambusinessinsider.in/tech/news…By@ShDivyanshi",twitter,,"Oct 30, 2024 · 9:30 AM UTC",@BiIndia,https://x.com/BiIndia/status/1851557153288360439
ಬ್ಲಿಂಕಿಟ್‌ನಲ್ಲಿ ಚಿನ್ನದ ನಾಣ್ಯ ಆರ್ಡರ್‌ ಮಾಡಿದ್ದ ವ್ಯಕ್ತಿಗೆ ಮೋಸ!#Blinkit#GoldCoin#Scam#Gold#DeepinderGoyal#Zomato#Business@letsblinkit@deepigoyal@Malabartweetskannada.asianetnews.com/busi…,twitter,,"Oct 29, 2024 · 2:40 PM UTC",@AsianetNewsSN,https://x.com/AsianetNewsSN/status/1851272865821389109
Blinkit is a scam these days. Their customer care is a shitshow of a joke. Even tagging them here has never gotten me a response nevermind a solution. Avoid ordering expensive stuff from them.,twitter,,"Oct 29, 2024 · 8:03 AM UTC",@GirdharManas,https://x.com/GirdharManas/status/1851172933928194477
"Blinkit and Zepto are just providing the platform... Malabar etc are the seller.

Local vendors are greedy and they try to scam you",twitter,,"Oct 29, 2024 · 4:00 AM UTC",@Sizzle_ola,https://x.com/Sizzle_ola/status/1851111793231602081
nitter.net/happyysisyphus/status/…Flipkart Scam Alert: Missing item#CustomerServiceFail#ConsumerRights#CustomerSupport#BadService#ServiceFail#ConsumerAwareness#IndiaConsumers#ConsumerComplaint#BrandResponsibility#Escalate#CustomerFirst#VoiceOfConsumers#BBRAmplifies#MakeItRight#NoMoreExcuses#Latest#India#BigBreaking#breaking#latest#updates#trending#viral#poorService#worstService#ecommerce#jagoGrahakJago#amazon#flipkart#myntra#zomato#swiggy#blinkit#croma#ola#jio#airtel,twitter,,"Sep 22, 2024 · 10:04 AM UTC",@BandBajaateRaho,https://x.com/BandBajaateRaho/status/1837795019438137429
"आज  सुबह सुबह सो कर उठा देखा Flipkart Scam चल रहा है तो भइया बात इतनी सी ही है ऐसे तो सबको ऑनलाइन चाहिए सामान, कोई फंक्शन हो तो चंदा छोटे दुकानदारों से चाहिए गणेश चतुर्थी हो ,या जागरण या कोई भंडारा चंदा दुकानदारों से चाहिए जब समान खरीदने की बारे आए तो ऑनलाइन ऐसा दोगलापन क्यू भाई कल को आपको जब जरूरत पड़ती तो यही दुकानदार आपके काम आता कल को पैसे की जरूरत पड़ती तो तनिष्क या ऑनलाइन वाले कम नहीं आते आपके आस पास के सुनार काम आते की व्याज पर पैसे मिल जाए भाई आप इन दुकानदारों के लिए नही सोचते ऊपर से ट्रेंड चलाते है की ये scam फलाना scam 
कभी अपने आस पास की दुकानों में भी जय परिवार इनके भी होते है आप के इन ऑनलाइन के चक्कर में कितना नुकसान होता कितने व्यापार बंद हो जाते, 
लोकल बनिए ओर अपने आस पास की दुकानों से दुकानदारी करे , ये सब बस हमारे धर्म के खिलाफ पोस्टर जारी करते आस्था को ठेस पहुंचाते फिर भी आप लोग इनके पीछे पागल है 
बस इतना ही है अपने आस पास के व्यापारियों का ध्यान रखे सामान उन्ही से खरीदे 
ये। BLINKIT, MYNTRA, AMAZON, FLIPKART, ZOMATO, SWEEGY , इन सबसे दूरी बनाए अपने आस पास की अर्थव्यवस्था को ठीक करे संबंध अच्छे बनाए क्योंकि यही आपके काम आयेंगे ये E–COMERCE वाले नही काम आयेंगे ।।#flipkartscam",twitter,,"Sep 18, 2024 · 4:39 AM UTC",@Shubh_soni06,https://x.com/Shubh_soni06/status/1836263871902052625
"Ordered Himalaya Natives raw honey from Blinkit, but the nutrition info on the product is completely different from what they showed on Blinkit! Total scam, misleading people!@letsblinkit@BBCHindi@fssaiindia#ScamAlert@JPNadda@zomato",twitter,,"Sep 17, 2024 · 5:08 PM UTC",@TrainTravel_,https://x.com/TrainTravel_/status/1836089828989120999
"I contacted the Blinkit support team via email, and I haven't received any response, let alone a resolution. This level of service is completely a scam to say the least.@blinkitcares@deepigoyal",twitter,,"Aug 9, 2024 · 10:08 AM UTC",@devansh_tweets,https://x.com/devansh_tweets/status/1821851127140209044
New scam of@blinkit. No rain at all. And they are taking extra 30 rupees rain charges.,twitter,,"Jul 21, 2024 · 7:58 AM UTC",@jisha35,https://x.com/jisha35/status/1814932832935944328
It's a scam they only show the low initial time to keep it lesser than blinkit 😂😂,twitter,,"May 6, 2024 · 4:02 AM UTC",@codingmickey,https://x.com/codingmickey/status/1787332186632597536
Zepto’s UI is ass compared to Blinkit and Instamart and their inventory issues and fake delivery times are full scam. How are they still in business,twitter,,"May 3, 2024 · 7:48 AM UTC",@PecanPie03,https://x.com/PecanPie03/status/1786301676984369481
"For the benefit of a wider good, please be aware of the scam Blinkit is running. You choose a striped watermelon (expensive) & they send you a normal one (100 rs less) + never adhere to approx. weights they potray.#BlinkitScam#Zomato@albinder@deepigoyal",twitter,,"Mar 31, 2024 · 12:16 PM UTC",@ShehneelaKhan,https://x.com/ShehneelaKhan/status/1774410377469874416
Some kind of scam is going on here first up round to blinkit now Shiprocket ...,twitter,,"Dec 21, 2023 · 4:33 PM UTC",@Dhruvapandey,https://x.com/Dhruvapandey/status/1737874027879031142
blinkit bech do scam kar diya mere sath,twitter,,"Aug 6, 2023 · 5:47 AM UTC",@imaradiohead_v,https://x.com/imaradiohead_v/status/1688064285661093890
"Online stores like@letsblinkittakes your money, do not deliver anything and they on help section apologize to you, they will refund in 7 days.

It's better to buy from your local grocery store.

Swiggy or Blinkit, they are nothing but scam",twitter,,"Jul 1, 2023 · 4:28 PM UTC",@samarinamkhan,https://x.com/samarinamkhan/status/1675179514417258496
"I use blinkit, it is fast but I uninstalled zomato due to this fake promise. This is a clear scam.",twitter,,"May 10, 2023 · 9:22 PM UTC",@pran7singh,https://x.com/pran7singh/status/1656409483289980931
"#CyberPeaceBlog📝 | The#DMart,#BigBasket, and#Blinkit#cyber#scamis a wake-up call for consumers and businesses regarding the importance of#cybersecurity. Visitbit.ly/41PhIK5to read more via#CyberPeace☮️.#Blog#MustRead#CyberSecurityAwareness",twitter,,"Apr 25, 2023 · 6:04 PM UTC",@cyberpeacecorps,https://x.com/cyberpeacecorps/status/1650923766430699520
"startups in india were never about making profits. They don't even relate to profit or anything close to it. it's a wayy bigger scam than that lol. people who actually know what I'm saying will agree. Look at zomato, ola, blinkit, paytm etc. 
Iykyk. they make billions indirectly",twitter,,"Jan 17, 2023 · 10:46 PM UTC",@GautamSabharwa1,https://x.com/GautamSabharwa1/status/1615480676463280132
"@SEBI_India@MCA21IndiaDetail investigation needs to be done on Zomato -blinkit deal , has a potential of a big scam being uncovered . From every angle the deal looks shady and scamy.@AnilSinghvi_has done great job in highlighting the same yesterday.",twitter,,"Jun 28, 2022 · 5:24 AM UTC",@akshay_gupta55,https://x.com/akshay_gupta55/status/1541653747889078274
"Blinkit (Formerly known as Grofers) is a total scam. Here's how:
 (A short thread)",twitter,,"Jan 8, 2022 · 5:16 PM UTC",@Punn_dit,https://x.com/Punn_dit/status/1479864720282710016
As per service centre it's delayed as purchased from blinkit. The BSM said on 7/7/2026 replacement geyser sent from Patna warehouse. It's more than 2 months the geyser is out of service. Didn't expect such poor service from Orient Electric,twitter,,"Jul 17, 2026 · 12:24 PM UTC",@sunilbawsay,https://x.com/sunilbawsay/status/2078093580753834369
"I ordered India Gate Basmati Rice but received mostly broken rice grains. I shared photo proof with Blinkit Support, but they didn't resolve my problem  and closed the chat without any refund or replacement. Please resolve this@letsblinkit@blinkitcares@IndiaGateFoods@nch1915",twitter,,"Jul 16, 2026 · 4:04 PM UTC",@OmPraka91461310,https://x.com/OmPraka91461310/status/2077786585043784027
I feel cheated by Blinkit. I received an incomplete product with missing parts. Your policy allows replacement for faulty or incorrect products. how is a product with missing parts not faulty or incorrect? Please honor your policy and resolve this issue.@letsblinkit@albinder,twitter,,"Jul 14, 2026 · 7:03 PM UTC",@manu143manish,https://x.com/manu143manish/status/2077106650968895865
"@RockWithboAtboAt Rockerz 371 is facing mic issues and poor battery backup.
I am a physically disabled person and unable to visit the service centre. I purchased it through Blinkit expecting easy replacement support.
Please arrange home pickup & replacement under warranty.",twitter,,"Jul 14, 2026 · 12:55 PM UTC",@arvindkumar9508,https://x.com/arvindkumar9508/status/2077014173347917851
"Please share a definite timeline for the investigation and confirm when I will receive either a replacement or a full refund.

I hope Blinkit treats this matter with the urgency it deserves.",twitter,,"Jul 14, 2026 · 12:39 PM UTC",@Arpit_Panwar_,https://x.com/Arpit_Panwar_/status/2077010058312098250
"You have told me to contact one plus. But they have categorically said for return and replacement kindly contact blinkit. 
I am stucked",twitter,,"Jul 14, 2026 · 7:11 AM UTC",@vivekpandeyz,https://x.com/vivekpandeyz/status/2076927443190075534
@albinder@letsblinkit@blinkitcaresnow your customer support is saying product is delivered by brand and not blinkit. what kinda joke is this ? product has 7 days replacement policy from blinkit but your support agent is denying,twitter,,"Jul 13, 2026 · 9:42 AM UTC",@souravp2330,https://x.com/souravp2330/status/2076603225336377382
"Dear@letsblinkit,

I ordered a mixer grinder from one brand, but a completely different brand was delivered. This is unacceptable. Please arrange an immediate replacement with the correct product or issue a full refund.#Blinkit#WrongProduct",twitter,,"Jul 13, 2026 · 9:24 AM UTC",@arora0025_sunny,https://x.com/arora0025_sunny/status/2076598682066317803
"Thomas Cook India has launched its 𝗭𝗲𝗿𝗼 𝗠𝗮𝗿𝗸𝘂𝗽 𝗙𝗼𝗿𝗲𝘅 𝗖𝗮𝗿𝗱, a relaunch of its One Currency Card, designed to offer enhanced value to frequent international travellers. ✈️ This new offering eliminates foreign exchange mark-up charges on card loading & cross-currency conversion fees, making overseas spending more cost-efficient & transparent.

Key features of the Zero Markup Card include:

- 𝗭𝗲𝗿𝗼 𝗙𝗼𝗿𝗲𝘅 𝗠𝗮𝗿𝗸𝘂𝗽: No additional charges when loading foreign exchange onto the card.
- 𝗭𝗲𝗿𝗼 𝗖𝗿𝗼𝘀𝘀-𝗖𝘂𝗿𝗿𝗲𝗻𝗰𝘆 𝗖𝗼𝗻𝘃𝗲𝗿𝘀𝗶𝗼𝗻 𝗖𝗵𝗮𝗿𝗴𝗲𝘀: Seamless payments in currencies beyond USD without extra conversion costs.
- 𝗣𝗿𝗼𝘁𝗲𝗰𝘁𝗶𝗼𝗻 𝗔𝗴𝗮𝗶𝗻𝘀𝘁 𝗖𝘂𝗿𝗿𝗲𝗻𝗰𝘆 𝗩𝗼𝗹𝗮𝘁𝗶𝗹𝗶𝘁𝘆: Customers can pre-load the card in USD & lock in exchange rates, safeguarding against fluctuations in the INR & major global currencies. 🛡️

This digital-first product is available via Thomas Cook India's website, mobile app (TC Pay), WhatsApp, call centre, & Blinkit.

Additional benefits include:

- 10% cashback on spends at popular brands (e.g., McDonald's, Starbucks, KFC). 💰
- Secure contactless payments via Google Pay's Tap & Pay.
- Complimentary insurance cover up to ₹7,50,000. 📄
- Free emergency cash assistance & zero-cost card replacement.
- Global acceptance across 200+ countries wherever Mastercard is accepted. 🌍

Mr. Deepesh Varma, Chief Business Officer – Foreign Exchange, stated that the card addresses the needs of value-conscious & digitally savvy travellers by offering control over overseas spends & protection from exchange rate movements, reinforcing Thomas Cook's position as 'India ka Forex Specialist'. ✨

📊 THOMAS COOK (INDIA) LTD | 🏷️ Press Release / Media Release

🌐 Details:wegro.app/Wk0THa⚡️Instant stock alerts on WhatsApp - Try FREE 👉wegro.app/go",twitter,,"Jul 13, 2026 · 9:07 AM UTC",@wegro_app,https://x.com/wegro_app/status/2076594376759992401
"If this issue is not resolved promptly with a refund or replacement, I will be forced to escalate the matter to consumer grievance forums.

Kindly address this urgently#Blinkit#CustomerComplaint#PoorCustomerServiceBeforeposting, attach clear photos@blinkitcares",twitter,,"Jul 12, 2026 · 4:19 PM UTC",@Arpit_Panwar_,https://x.com/Arpit_Panwar_/status/2076340792269140088
"I Ordered an HDD Enclosure on 8 Jul 2026. It was defective and didn't work. I raised a complaint, but Blinkit service was unavailable in my area for 3–4 days. When service resumed, the return window had closed.@letsblinkitplease help with a return, refund, or replacement.",twitter,,"Jul 12, 2026 · 1:55 PM UTC",@dot_sm_,https://x.com/dot_sm_/status/2076304362868297804
"@letsblinkitI ordered these earbuds from Blinkit, but the sound quality is extremely poor. I can't even have a proper conversation on calls because the voice is unclear.
When I spoke with your executive, I was informed that only a replacement is available, I want refund pls",twitter,,"Jul 12, 2026 · 1:05 PM UTC",@piyushpallow,https://x.com/piyushpallow/status/2076291807802167600
I hope these glasses are unused and you guys have a plan for a replacement. Like my experience with blinkit they often sell used products. Now once delivered they just don't care.@blinkitcaresisn't it right ?,twitter,,"Jul 11, 2026 · 3:42 PM UTC",@mayur_khadtare,https://x.com/mayur_khadtare/status/2075969051755683850
"Bought a VGA cable from@letsblinkit. It’s defective and doesn’t work on multiple devices. My old damaged cable is still detected, but the new one isn’t. Blinkit refused a refund/replacement, saying the “correct product” was delivered.",twitter,,"Jul 11, 2026 · 3:12 PM UTC",@Abhishe98921849,https://x.com/Abhishe98921849/status/2075961469859156145
As much I talk with Blinkit service guys it is getting worsen.@blinkitcares@RockWithboAtdo something ? I am only asking for replacement of the defected product ?#never_buy_from_blinkit.,twitter,,"Jul 11, 2026 · 12:30 PM UTC",@mayur_khadtare,https://x.com/mayur_khadtare/status/2075920552846610479
@blinkitcaresyour support guy telling me they get products directly from BoAt.@RockWithboAtSince when you guys are sending tobacco in the soundbar package. Do not include aux  & charging cable. And the color faded soundbar on blinkit with no replacement. ?Is this new policy ?,twitter,,"Jul 11, 2026 · 12:26 PM UTC",@mayur_khadtare,https://x.com/mayur_khadtare/status/2075919657824117176
