text,source,rating,date,author,url
Source- Blinkit and chroma. Now you can Calm your ego down. No point in lowballing as why would anyone purchase from you if a trusted site for pre-owned games selling it for just 200-300 extra including shipping cost while you as a scumbag posting advt on reddit and trying to scam people.,reddit,,2025-08-26T13:16:43.000Z,hrishikesh_d01,https://www.reddit.com/r/ps5india/comments/1n0jcjj/selling_gta_5_got/narcn10/
"Flipkart toe bhaut bekar hai. Bhaut scam karta hai liken amazon sa mai personally 15 saal sa jada use kar rahi hu. Aur maine khud phone, washing machine aur AC tak amazon sa purchase kiya hai aur kabhi bhi mujhe duplicate and scamy product nahi mila hai. Mujhe hamesha 100% original product mila hai. Aur maine blinkit sa bhaut costly product order nahi kiya hai toe mujhe etna idea nahi hai. Mai normally ghar ka rashan he order karti hu",reddit,,2025-12-30T14:13:03.000Z,Chad_Raukla,https://www.reddit.com/r/FuckBlinkit/comments/1pze9kd/mine/nwqe316/
Zepto and blinkit bhi add krle mittar aur scam mat karna kabhi,reddit,,2025-11-09T04:29:33.000Z,Only-Debt643,https://www.reddit.com/r/FuckZepto/comments/1orlj05/realized_i_paid_130_extra_for_the_same_biryani_so/nnvqp9t/
"Did I just get scammed by blinkit?
So my grandfather had ordered some items from blinkit 25 days ago, the order had failed but money was deducted. When we contacted support via their app it showed that they will give us the refund in 3-4 business days for that failed order. It&#39;s been more than 25 days now and we did not get a refund, when I tried to check that failed order....It just was not there. so basically: 1- My money was deducted but order had failed 2- The order goes missing all of a sudden 3- I cannot contact them about that order anymore 4- I did not get a refund... Sadly I had not even taken a screenshot to show my failed order refund status at that time. So is there any clue how can I get help? Thankyou  &#32; submitted by &#32;  /u/V8Thunder_   [link] &#32; [comments]",reddit,,2026-01-15T13:07:59.000Z,V8Thunder_,https://www.reddit.com/r/blinkit/comments/1qdj184/did_i_just_get_scammed_by_blinkit/
"/u/[deleted] on Did I just get scammed by blinkit?
Write an email with payment details. If not refunded within one month, complain to nch",reddit,,2026-01-16T05:31:01.000Z,[deleted],https://www.reddit.com/r/blinkit/comments/1qdj184/did_i_just_get_scammed_by_blinkit/nzvcsqc/
"/u/metacritical on Did I just get scammed by blinkit?
Everything is super expensive on blinket, i checked the market price of 30 Eggs its currently 240/ 30 eggs. On Blinkit/Shlinkit it is 311 / 30 eggs. That a difference of 71 rupees per crate, this is the same with all kinds of delivery stuff including Zomato. People shoudl wake up and stop using these services. Which give you way less for way more. Use something like D-Mart or Amazon fresh which is next day delivery but without such an exorbitant markup. I wonder what the Stock traders and SEBI thought when including a delivery app like Zomato in the Index ? This will sink indian economy one day and should be remove from the Index. All these delivery companies shoudl be banned from IPO&#39;ing or will sink the Indian economy bigtime someday.",reddit,,2026-01-16T12:00:31.000Z,metacritical,https://www.reddit.com/r/blinkit/comments/1qdj184/did_i_just_get_scammed_by_blinkit/nzwmh7k/
"Blinkit just stopped replying to me, These companies are pure scam
I ordered an ssd from blinkit, and it won&#39;t work and blinkit just started ghosting me   &#32; submitted by &#32;  /u/maakabharosacolgate   [link] &#32; [comments]",reddit,,2025-09-14T15:14:51.000Z,maakabharosacolgate,https://www.reddit.com/r/delhi/comments/1ngtum2/blinkit_just_stopped_replying_to_me_these/
"guys is this valid , i tried sending a legal notice to blinkit
&#32; submitted by &#32;  /u/Practical-Tough8229   [link] &#32; [comments]",reddit,,2026-06-10T11:56:15.000Z,Practical-Tough8229,https://www.reddit.com/r/Indianlaw/comments/1u201s1/guys_is_this_valid_i_tried_sending_a_legal_notice/
"/u/CalendarRadiant8769 on guys is this valid , i tried sending a legal notice to blinkit
Gand ka ilaaj ho sakta hai par ganduon ka nahi",reddit,,2026-06-10T12:07:15.000Z,CalendarRadiant8769,https://www.reddit.com/r/Indianlaw/comments/1u201s1/guys_is_this_valid_i_tried_sending_a_legal_notice/oqtmmps/
"/u/Practical-Tough8229 on guys is this valid , i tried sending a legal notice to blinkit
😂😂",reddit,,2026-06-10T12:17:21.000Z,Practical-Tough8229,https://www.reddit.com/r/Indianlaw/comments/1u201s1/guys_is_this_valid_i_tried_sending_a_legal_notice/oqtoe9g/
"/u/sonal1988 on guys is this valid , i tried sending a legal notice to blinkit
😂😂",reddit,,2026-06-12T01:56:23.000Z,sonal1988,https://www.reddit.com/r/Indianlaw/comments/1u201s1/guys_is_this_valid_i_tried_sending_a_legal_notice/or5fron/
"/u/Eagle__Gunner on guys is this valid , i tried sending a legal notice to blinkit
You received an expired product or are you suggesting the milk and ice cream were not stored under proper conditions? A product may not be expired but not for for consumption due to poor storage standards. Alternately Blinkit may not be liable for products that are stored properly but the manufacturer due to quality issues. Did you buy the icecream after receiving the poor milk or got in a single delivery. Total price for refund includes both icecream and milk right. Mention the timeline, order details, issue raised time with the customer support or the bot.",reddit,,2026-06-10T12:09:08.000Z,Eagle__Gunner,https://www.reddit.com/r/Indianlaw/comments/1u201s1/guys_is_this_valid_i_tried_sending_a_legal_notice/oqtmybl/
"/u/Practical-Tough8229 on guys is this valid , i tried sending a legal notice to blinkit
I receive an expired item with faded manufacturing and use-by date that tasted bad and smelled like shit water so i cant even tell if it is expired but it surely was spoiled , i have the video evidence of it curdling up. And i was trying to escalate this situation to consumer court because the bot or customer support was not responsive of my complaints",reddit,,2026-06-10T12:15:42.000Z,Practical-Tough8229,https://www.reddit.com/r/Indianlaw/comments/1u201s1/guys_is_this_valid_i_tried_sending_a_legal_notice/oqto3wg/
"/u/zeroesstar on guys is this valid , i tried sending a legal notice to blinkit
What you reported is a grievance to their support team, consult a Lawyer to send a formal legal notice, though filing a case with DCF may not need a Lawyer yet seeking their assistance from the start can make your case strong  I&#39;ve dealt cases both at District and State Level, even the slightest oversight by the Consumer can lead to claim being denied",reddit,,2026-06-10T13:29:01.000Z,zeroesstar,https://www.reddit.com/r/Indianlaw/comments/1u201s1/guys_is_this_valid_i_tried_sending_a_legal_notice/oqu2380/
"/u/Practical-Tough8229 on guys is this valid , i tried sending a legal notice to blinkit
I will ask my friends dad for assistance he is a lawyer i have 40k in my savings will that be enough cause i am just 18 so i dont have a lot of money",reddit,,2026-06-10T13:39:50.000Z,Practical-Tough8229,https://www.reddit.com/r/Indianlaw/comments/1u201s1/guys_is_this_valid_i_tried_sending_a_legal_notice/oqu4b8o/
"/u/throwawayA2X on guys is this valid , i tried sending a legal notice to blinkit
Technically valid but it might not be taken as seriously as a notice sent with the help of an advocate.  This one at its core is just an angry demand letter from a customer",reddit,,2026-06-10T13:32:19.000Z,throwawayA2X,https://www.reddit.com/r/Indianlaw/comments/1u201s1/guys_is_this_valid_i_tried_sending_a_legal_notice/oqu2riq/
"/u/Practical-Tough8229 on guys is this valid , i tried sending a legal notice to blinkit
I will contact a lawyer now and also go to a medical professional to get the health side effects of that rotten milk in written cause my stomach hurts after drinking some of that milk 😭✌🏻",reddit,,2026-06-10T13:42:50.000Z,Practical-Tough8229,https://www.reddit.com/r/Indianlaw/comments/1u201s1/guys_is_this_valid_i_tried_sending_a_legal_notice/oqu4xlu/
"/u/zeroesstar on guys is this valid , i tried sending a legal notice to blinkit
There won&#39;t be any Court fees for your claim, just for filing your Lawyer may charge or that can be free of cost too.",reddit,,2026-06-10T13:54:29.000Z,zeroesstar,https://www.reddit.com/r/Indianlaw/comments/1u201s1/guys_is_this_valid_i_tried_sending_a_legal_notice/oqu7d5e/
"/u/Practical-Tough8229 on guys is this valid , i tried sending a legal notice to blinkit
Ok then i am ready to slime blinkit 🥷",reddit,,2026-06-10T13:56:27.000Z,Practical-Tough8229,https://www.reddit.com/r/Indianlaw/comments/1u201s1/guys_is_this_valid_i_tried_sending_a_legal_notice/oqu7s8i/
"/u/xoso11 on guys is this valid , i tried sending a legal notice to blinkit
This is not how a legal notice is sent.",reddit,,2026-06-10T17:53:44.000Z,xoso11,https://www.reddit.com/r/Indianlaw/comments/1u201s1/guys_is_this_valid_i_tried_sending_a_legal_notice/oqvplqb/
"/u/Ill-Ant-8408 on guys is this valid , i tried sending a legal notice to blinkit
That&#39;s strange. They usually refund.",reddit,,2026-06-10T19:47:28.000Z,Ill-Ant-8408,https://www.reddit.com/r/Indianlaw/comments/1u201s1/guys_is_this_valid_i_tried_sending_a_legal_notice/oqwfata/
"/u/Practical-Tough8229 on guys is this valid , i tried sending a legal notice to blinkit
usually is a big term 😭its not even about the milk it is about the shit that tastes like piss water and smells like sewage plant went into my mouth",reddit,,2026-06-10T19:51:23.000Z,Practical-Tough8229,https://www.reddit.com/r/Indianlaw/comments/1u201s1/guys_is_this_valid_i_tried_sending_a_legal_notice/oqwg6ag/
"is blinkit hacked?
are these the real names of the drinks qt?  &#32; submitted by &#32;  /u/No-Relation-9482   [link] &#32; [comments]",reddit,,2026-06-05T15:54:55.000Z,No-Relation-9482,https://www.reddit.com/r/SnacksIndia/comments/1txoxhk/is_blinkit_hacked/
"/u/Specialist-Drop-7432 on is blinkit hacked?
Loved the mango bango, and yeah those are real names. Personally i liked this more than red bull and monster.",reddit,,2026-06-05T15:59:57.000Z,Specialist-Drop-7432,https://www.reddit.com/r/SnacksIndia/comments/1txoxhk/is_blinkit_hacked/opxcdc9/
"/u/No-Relation-9482 on is blinkit hacked?
I&#39;ve never tried it but I defo do not like monster and red bull so I&#39;m gonna give this a try",reddit,,2026-06-05T16:05:31.000Z,No-Relation-9482,https://www.reddit.com/r/SnacksIndia/comments/1txoxhk/is_blinkit_hacked/opxdlxj/
"/u/Sudden_Mix9724 on is blinkit hacked?
U thought they were selling illegal Dgs for cheap?",reddit,,2026-06-05T16:34:25.000Z,Sudden_Mix9724,https://www.reddit.com/r/SnacksIndia/comments/1txoxhk/is_blinkit_hacked/opxk3gr/
"/u/iimv_research on is blinkit hacked?
Worst drink ever, i must say sting is way better than this shit",reddit,,2026-06-05T16:25:29.000Z,iimv_research,https://www.reddit.com/r/SnacksIndia/comments/1txoxhk/is_blinkit_hacked/opxi3dt/
"/u/sportsfan3103 on is blinkit hacked?
Caffeine content?",reddit,,2026-06-05T16:53:28.000Z,sportsfan3103,https://www.reddit.com/r/SnacksIndia/comments/1txoxhk/is_blinkit_hacked/opxodym/
"/u/D4rth_vad3r on is blinkit hacked?
Arrange you a little cutie?",reddit,,2026-06-05T16:02:08.000Z,D4rth_vad3r,https://www.reddit.com/r/SnacksIndia/comments/1txoxhk/is_blinkit_hacked/opxcv1y/
"Got scammed by Blinkit delivery Guy
Hi there so this incident is of like 20-25 days back I had ordered one thing from blinkit like normal day the delivery guy came knocked the door as mostly they will not call they will just cometo the door and know there it self only if we not respond they they will call before giving me the order started saying like he&#39;s got caught by police and they took his bike and from there he came by walk to deliver this, and showed me like he&#39;s not able to use any applications for calling and things showing the work account and normal one tried calling but not able to call,  I was like okay what I can do give me my order  After giving he started asking for like 200 to give to police so that he can get his bike back  I was like okay he seems like to be in the trouble 😵‍💫, later he added that he will return this money back in 5 mins only,  I give him 200 on his google pay (this was may mistake)  To give me assurance he asked for my number and called me so I have his number now I was like okay he will return it back in 5-10 mins that will be okay  When he was going I saw from my window that he was going on bike and realised that had I made a mistake?  Still thinking that he will be in trouble so he will return me back the money he took and like this 1 hrs have completed and no money or anything i received  I called on the number he picked up i asked for the money he said he still haven&#39;t got his bike back and now in police station (That time I should have asked for proofs of it but i didn&#39;t)  Again after 2 hrs I called him he didn&#39;t picked up first time calling 2nd time call got picked up but the person talking was different and he was like speeking in hindi buy had that kannada accent the person whom I gave money was talking in fluent Hindi like normal  So this new person is saying like that person who delivered the order and took money from me is his delivery guy and he&#39;s like broker to provide the delivery guys to these apps I know all this was bs and said like you are the person or he was, who supposed to deliver the order he said that person but like again this is bs only i know  Cutting to the chase i told his things like came for delivery -&gt; taken money -&gt; told to return -&gt; but I haven&#39;t got  He said he cannot do anything and i said I will complain in blinkit support  With full confidence he was like okay go and do  And i said don&#39;t worry I will do  The things for which I fell was like from start he was asking for help and it&#39;s hard for me to say no, He was talking in hindi, and this assurance thing like giving his number and telling to return on 5 mins   &#32; submitted by &#32;  /u/MiserableAd7685   [link] &#32; [comments]",reddit,,2026-01-12T10:28:37.000Z,MiserableAd7685,https://www.reddit.com/r/Bengaluru/comments/1qarfyb/got_scammed_by_blinkit_delivery_guy/
"Do not trust this platform, blinkit - unethical practices.
Hello , I have been observing this for quite some time that this platform blinkit is implementing some unethical practises by altering product MRP&#39;s and selling them at different prices than the actual MRP, check here once. I observed this on my third order. Check the actual prices before ordering something, don&#39;t just trust this platform.    [link] &#32; [comments]",reddit,,2026-04-20T11:06:22.000Z,,https://www.reddit.com/r/blinkit/comments/1sqm3kr/do_not_trust_this_platform_blinkit_unethical/
"/u/Extreme_GamerYT on Do not trust this platform, blinkit - unethical practices.
but the actual mrp is 80rs only check the price on the protein bar.",reddit,,2026-04-20T11:35:31.000Z,Extreme_GamerYT,https://www.reddit.com/r/blinkit/comments/1sqm3kr/do_not_trust_this_platform_blinkit_unethical/oh8q3la/
"/u/[deleted] on Do not trust this platform, blinkit - unethical practices.
No..no, the MRP is 71/- only, checked the price in their website https://maxprotein.in/collections/max-protein-bar/products/ritebite-max-protein-daily-choco-almond-10g",reddit,,2026-04-20T14:42:33.000Z,[deleted],https://www.reddit.com/r/blinkit/comments/1sqm3kr/do_not_trust_this_platform_blinkit_unethical/oh9o08d/
"/u/Extreme_GamerYT on Do not trust this platform, blinkit - unethical practices.
maybe old pricing or something else but at my place it&#39;s 70rs only see",reddit,,2026-04-20T14:48:57.000Z,Extreme_GamerYT,https://www.reddit.com/r/blinkit/comments/1sqm3kr/do_not_trust_this_platform_blinkit_unethical/oh9pd96/
"/u/[deleted] on Do not trust this platform, blinkit - unethical practices.
exactly, everywhere they are selling the same at 70rs where the MRP is 71rs, but in blinkit its 80rs and selling at 79rs",reddit,,2026-04-20T14:57:44.000Z,[deleted],https://www.reddit.com/r/blinkit/comments/1sqm3kr/do_not_trust_this_platform_blinkit_unethical/oh9r8h2/
"/u/Extreme_GamerYT on Do not trust this platform, blinkit - unethical practices.
In my blinkit it&#39;s 70rs, see I have attached the image",reddit,,2026-04-20T15:05:32.000Z,Extreme_GamerYT,https://www.reddit.com/r/blinkit/comments/1sqm3kr/do_not_trust_this_platform_blinkit_unethical/oh9stbm/
"/u/Bulbasaur_bhaijan on Do not trust this platform, blinkit - unethical practices.
Brands have different MRPs for different channels. Makes sense to sell a lower MRP variant in their own site. Furthermore, the product is Out of stock in their website. It can also be a case where they have stopped selling that price pack.",reddit,,2026-04-20T12:58:16.000Z,Bulbasaur_bhaijan,https://www.reddit.com/r/blinkit/comments/1sqm3kr/do_not_trust_this_platform_blinkit_unethical/oh93kix/
"/u/[deleted] on Do not trust this platform, blinkit - unethical practices.
You are not supposed to sell above the MRP decided by the manufacturer. https://maxprotein.in/collections/max-protein-bar/products/ritebite-max-protein-daily-choco-almond-10g",reddit,,2026-04-20T14:44:18.000Z,[deleted],https://www.reddit.com/r/blinkit/comments/1sqm3kr/do_not_trust_this_platform_blinkit_unethical/oh9odlr/
"/u/SukhaBhindiKaCum on Do not trust this platform, blinkit - unethical practices.
Read what the actual comment is, price can be different for different channels",reddit,,2026-04-20T17:33:31.000Z,SukhaBhindiKaCum,https://www.reddit.com/r/blinkit/comments/1sqm3kr/do_not_trust_this_platform_blinkit_unethical/ohaoptf/
"/u/[deleted] on Do not trust this platform, blinkit - unethical practices.
Know what the actual reality is, MRP of a product cannot be changed on different platforms, selling price can be. The Consumer Commission has held that printing or selling at different MRPs for the same material without any change in content or quantity was “nothing but unfair trade practice&quot;.",reddit,,2026-04-20T18:08:19.000Z,[deleted],https://www.reddit.com/r/blinkit/comments/1sqm3kr/do_not_trust_this_platform_blinkit_unethical/ohawbnk/
"/u/bonkhornyprison on Do not trust this platform, blinkit - unethical practices.
Do you have dyslexia? Manufacturers can manufacture two identical products with slight design changes in cover with different MRPs. The product sold in blinkit and website are identical but not same. You can see one is lighter shade of blue and other has darker shade of blue.  This may or may not be ethical. But, This is completely legal.  Same logic where beverages cost different inside airports and movie theatres.",reddit,,2026-04-20T18:24:05.000Z,bonkhornyprison,https://www.reddit.com/r/blinkit/comments/1sqm3kr/do_not_trust_this_platform_blinkit_unethical/ohazmro/
"/u/[deleted] on Do not trust this platform, blinkit - unethical practices.
No, I just don’t confuse legality with integrity like you. Legal doesn’t automatically mean fair. Changing a shade of blue on the packaging doesn’t change the product, the cost, or the value delivered to the customer. Airports and theatres price higher due to controlled environments and convenience. That’s a different business model entirely. Selling the same product at different prices across platforms with superficial changes isn’t innovation, it’s price manipulation dressed up as differentiation.",reddit,,2026-04-20T18:43:19.000Z,[deleted],https://www.reddit.com/r/blinkit/comments/1sqm3kr/do_not_trust_this_platform_blinkit_unethical/ohb3o1n/
"/u/bonkhornyprison on Do not trust this platform, blinkit - unethical practices.
No, I just don’t confuse legality with integrity like you. Legal doesn’t automatically mean fair.  I didn&#39;t say it is fair. It is legal. It is what it is.   Airports and theatres price higher due to controlled environments and convenience. That’s a different business model entirely.  Selling in your own website is different environment from third party website.  Selling the same product at different prices across platforms with superficial changes isn’t innovation, it’s price manipulation dressed up as differentiation.  Rant as much as you need. You are paying for the convenience to get delivered in 10 mins. It is legal.",reddit,,2026-04-21T18:25:15.000Z,bonkhornyprison,https://www.reddit.com/r/blinkit/comments/1sqm3kr/do_not_trust_this_platform_blinkit_unethical/ohhlw7k/
"/u/[deleted] on Do not trust this platform, blinkit - unethical practices.
Don&#39;t think otherwise because of these 2 questions, only answer if it is ok with you. 1. What is your age? 2. Are you working in blinkit?",reddit,,2026-04-21T18:44:30.000Z,[deleted],https://www.reddit.com/r/blinkit/comments/1sqm3kr/do_not_trust_this_platform_blinkit_unethical/ohhpxja/
"/u/bonkhornyprison on Do not trust this platform, blinkit - unethical practices.
Around 30 No",reddit,,2026-04-22T03:53:51.000Z,bonkhornyprison,https://www.reddit.com/r/blinkit/comments/1sqm3kr/do_not_trust_this_platform_blinkit_unethical/ohkk2j5/
"/u/[deleted] on Do not trust this platform, blinkit - unethical practices.
Thank you for your response.",reddit,,2026-04-22T07:59:18.000Z,[deleted],https://www.reddit.com/r/blinkit/comments/1sqm3kr/do_not_trust_this_platform_blinkit_unethical/ohle81r/
"/u/limo97 on Do not trust this platform, blinkit - unethical practices.
The best question asked buddy.",reddit,,2026-04-23T02:17:56.000Z,limo97,https://www.reddit.com/r/blinkit/comments/1sqm3kr/do_not_trust_this_platform_blinkit_unethical/ohqvlkc/
"/u/impossible_espresso on Do not trust this platform, blinkit - unethical practices.
The manufacturer made a special version for blinkit with a different mrp It can have a very small diffrence than the other one and then too allowed",reddit,,2026-04-23T18:24:38.000Z,impossible_espresso,https://www.reddit.com/r/blinkit/comments/1sqm3kr/do_not_trust_this_platform_blinkit_unethical/ohv8qz2/
"/u/[deleted] on Do not trust this platform, blinkit - unethical practices.
[deleted]",reddit,,2026-04-20T18:40:20.000Z,[deleted],https://www.reddit.com/r/blinkit/comments/1sqm3kr/do_not_trust_this_platform_blinkit_unethical/ohb31df/
"/u/[deleted] on Do not trust this platform, blinkit - unethical practices.
Airports and railway stalls charge more because of captive demand and higher operating costs, that’s channel-based pricing. Here, the product is same, the cost structure has changed on this platform and blinkit is doing the same with other products too. https://food.ndtv.com/news/rs-55-on-pack-rs-60-on-app-video-calls-out-mrp-mismatch-on-blinkit-viewers-share-similar-experiences-11290268",reddit,,2026-04-20T18:46:55.000Z,[deleted],https://www.reddit.com/r/blinkit/comments/1sqm3kr/do_not_trust_this_platform_blinkit_unethical/ohb4f7q/
"/u/[deleted] on Do not trust this platform, blinkit - unethical practices.
Same issue https://www.reddit.com/r/FuckBlinkit/comments/1ogjzy3/blinkit_showing_higher_mrp_than_actual_be_aware/",reddit,,2026-04-20T18:49:46.000Z,[deleted],https://www.reddit.com/r/blinkit/comments/1sqm3kr/do_not_trust_this_platform_blinkit_unethical/ohb50z4/
"/u/[deleted] on Do not trust this platform, blinkit - unethical practices.
Are you one of those blinkit delivery partners?",reddit,,2026-04-23T07:06:50.000Z,[deleted],https://www.reddit.com/r/blinkit/comments/1sqm3kr/do_not_trust_this_platform_blinkit_unethical/ohrzusc/
"/u/[deleted] on Do not trust this platform, blinkit - unethical practices.
Just think about it (if it is possible it with you), you could have just said &quot;NO, IAM NOT, or a simple NO, But why that suffix &quot;tf&quot; before that &quot;no&quot;? No need to rush and respond but..just think on it.",reddit,,2026-04-23T07:13:45.000Z,[deleted],https://www.reddit.com/r/blinkit/comments/1sqm3kr/do_not_trust_this_platform_blinkit_unethical/ohs0mjc/
"/u/[deleted] on Do not trust this platform, blinkit - unethical practices.
that urge to respond to give back something,huh! good.",reddit,,2026-04-23T07:19:16.000Z,[deleted],https://www.reddit.com/r/blinkit/comments/1sqm3kr/do_not_trust_this_platform_blinkit_unethical/ohs187k/
"/u/[deleted] on Do not trust this platform, blinkit - unethical practices.
Ok, I am gonna have to get back to work, but your tf and this shut up comments tells me that your have to grow in your real personality, don&#39;t follow what&#39;s cool but develop what you are actually, and that&#39;s what make you unique in this almost fake world.",reddit,,2026-04-23T07:28:13.000Z,[deleted],https://www.reddit.com/r/blinkit/comments/1sqm3kr/do_not_trust_this_platform_blinkit_unethical/ohs277w/
"/u/letsmessitup on Do not trust this platform, blinkit - unethical practices.
Website pr order krega bhai to 4 din ne aayega.",reddit,,2026-04-23T12:10:55.000Z,letsmessitup,https://www.reddit.com/r/blinkit/comments/1sqm3kr/do_not_trust_this_platform_blinkit_unethical/oht18vs/
"/u/[deleted] on Do not trust this platform, blinkit - unethical practices.
bhai point vo nahi hai, aap MRP dal ke and convenience fee or delivery fee mei extra charges lelo, that is fair business right? company MRP ko aap kyu manipulate kar rahe ho? MRP 71/- dalo, selling price 70/- karo, and delivery charges direct 8, 9 or 10/- lelo. this is what I am saying, sad part is, edhar kuch logo ko manipulations bhi normal hai, aap neeche comments dheko.",reddit,,2026-04-23T17:59:19.000Z,[deleted],https://www.reddit.com/r/blinkit/comments/1sqm3kr/do_not_trust_this_platform_blinkit_unethical/ohv3657/
"/u/letsmessitup on Do not trust this platform, blinkit - unethical practices.
Mrp 80 hai bhai",reddit,,2026-04-23T18:28:34.000Z,letsmessitup,https://www.reddit.com/r/blinkit/comments/1sqm3kr/do_not_trust_this_platform_blinkit_unethical/ohv9m55/
